{
  "schemaVersion": 1,
  "revision": 1,
  "show": "true",
  "title": "&8Interaction check r1 - {{ player.name }}",
  "resolution": "9x3",
  "mask": ["#########", "#.......#", "#########"],
  "keys": {
    "#": { "type": "decoration", "icon": { "type": "item", "item": "minecraft:gray_stained_glass_pane", "name": " " } }
  },
  "slots": {
    "11": {
      "type": "button",
      "icon": { "type": "item", "item": "minecraft:lime_dye", "name": "&fConfirm interaction", "lore": ["&7Send a private confirmation."] },
      "actions": [{ "type": "message", "message": "GLOSS_QA_CONFIRMED {{ player.name }}" }]
    },
    "15": {
      "type": "button",
      "icon": { "type": "item", "item": "minecraft:barrier", "name": "&fClose menu" },
      "actions": [{ "type": "close" }]
    }
  },
  "closeOnTeleport": true,
  "variants": []
}
