{
  "schemaVersion": 1,
  "revision": 1,
  "show": true,
  "title": "&8Gloss inventory",
  "resolution": "9x3",
  "mask": [
    "#########",
    "#.......#",
    "#<##X##>#"
  ],
  "keys": {
    "#": {
      "type": "decoration",
      "icon": {
        "type": "item",
        "item": "minecraft:gray_stained_glass_pane",
        "name": " "
      }
    },
    "<": {
      "type": "button",
      "icon": {
        "type": "item",
        "item": "minecraft:arrow",
        "name": "&7Previous"
      },
      "actions": [
        {
          "type": "navigate",
          "mode": "page",
          "target": "prev"
        }
      ]
    },
    ">": {
      "type": "button",
      "icon": {
        "type": "item",
        "item": "minecraft:arrow",
        "name": "&7Next"
      },
      "actions": [
        {
          "type": "navigate",
          "mode": "page",
          "target": "next"
        }
      ]
    },
    "X": {
      "type": "button",
      "icon": {
        "type": "item",
        "item": "minecraft:barrier",
        "name": "&cClose"
      },
      "actions": [
        {
          "type": "close"
        }
      ]
    }
  },
  "slots": {
    "10": {
      "type": "button",
      "icon": {
        "type": "item",
        "item": "minecraft:diamond_sword",
        "name": "&bSword",
        "lore": [
          "&7Hover to inspect",
          "&7Click to select"
        ]
      },
      "actions": [
        {
          "type": "message",
          "message": "&aSword selected."
        }
      ]
    }
  },
  "closeOnTeleport": true,
  "variants": []
}
